{
  "schema_version": "iteration-state-record/v3",
  "id": "ITER-20260705-001",
  "title": "State-driven loop foundation",
  "status": "active",
  "created_at": "2026-07-05T15:29:32.273Z",
  "updated_at": "2026-09-12T03:18:16.506Z",
  "iteration_goal": "将 Arckit 状态机制升级为由显式 Project 软件定义、独立软件不变量、Case facts/impacts 和动态 Gap 共同驱动的软件项目控制面。",
  "project_state_ref": "arckit/project/state.record.json",
  "targets": [
    {
      "kind": "software_decision",
      "ref": "technical_foundation",
      "expected": "settled on the v5 software-definition ledger and Runtime contract",
      "reason": "The accepted model must replace the old dimension/condition protocol coherently."
    },
    {
      "kind": "project_gap",
      "ref": "GAP-agent-scenario-evaluation",
      "expected": "resolved with isolated real-task evidence",
      "reason": "Dynamic priority selection must work across different fact and dependency shapes."
    },
    {
      "kind": "software_invariant",
      "ref": "material-risks-have-credible-evidence",
      "expected": "upheld by automated and real execution evidence",
      "reason": "A protocol control plane requires evidence proportionate to cross-record and runtime risk."
    }
  ],
  "accepted_project_changes": [
    {
      "kind": "software_decision",
      "ref": "runtime_surfaces",
      "outcome": "The Desktop-to-Runtime-to-Codex-to-ledger surface completed a real bounded transition.",
      "evidence": [
        "arckit-runtime://runs/RUN-20260803-180157597Z",
        "arckit/cases/closed/CASE-20260707-002-implement-arckit-runtime-mvp.md"
      ],
      "case_ref": "arckit/cases/closed/CASE-20260707-002-implement-arckit-runtime-mvp.md"
    },
    {
      "kind": "software_decision",
      "ref": "product_capabilities",
      "outcome": "One coherent Agent turn now owns semantic gap execution while Runtime owns supervision and trusted writeback.",
      "evidence": [
        "arckit/spec/agentic-software-development/product-concepts.md",
        "arckit/cases/closed/CASE-20260809-002-simplify-arckit-runtime-around-a-coherent-codex-agent-loop.md"
      ],
      "case_ref": "arckit/cases/closed/CASE-20260809-002-simplify-arckit-runtime-around-a-coherent-codex-agent-loop.md"
    },
    {
      "kind": "software_decision",
      "ref": "technical_foundation",
      "outcome": "Facet workflow compatibility was removed before the explicit software-definition v5 redesign.",
      "evidence": [
        "arckit/cases/closed/CASE-20260809-007-remove-legacy-facet-state-protocol-compatibility.md"
      ],
      "case_ref": "arckit/cases/closed/CASE-20260809-007-remove-legacy-facet-state-protocol-compatibility.md"
    },
    {
      "kind": "software_decision",
      "ref": "technical_foundation",
      "outcome": "settled",
      "evidence": [
        "entry/skills/arckit-development-ledger/schema/project-state-record.schema.json",
        "entry/skills/arckit-development-ledger/schema/development-case-record.schema.json",
        "entry/skills/arckit-development-ledger/schema/case-transition.schema.json",
        "entry/skills/arckit-development-ledger/scripts/project-software-definition.mjs",
        "entry/skills/arckit-development-ledger/scripts/project-invariants.mjs",
        "runtime/arckit-runtime/schemas/agent-loop-result.schema.json",
        "runtime/arckit-runtime/schemas/runtime-result.schema.json",
        "runtime/arckit-runtime/test/project-ledger-governance.test.mjs",
        "runtime/arckit-runtime/test/state-condition-case.test.mjs",
        "verification:npm-run-check:84-tests-83-pass-1-conditional-skip",
        "verification:npm-run-smoke:valid-runtime-result",
        "verification:arcforge-applied-drift:using-arckit-and-ledger-same",
        "arckit/cases/active/CASE-20260810-001-implement-explicit-software-definition-project-state.md"
      ],
      "case_ref": "arckit/cases/active/CASE-20260810-001-implement-explicit-software-definition-project-state.md"
    },
    {
      "kind": "project_gap",
      "ref": "GAP-project-state-v5",
      "outcome": "resolve",
      "evidence": [
        "entry/skills/arckit-development-ledger/schema/project-state-record.schema.json",
        "entry/skills/arckit-development-ledger/schema/development-case-record.schema.json",
        "entry/skills/arckit-development-ledger/schema/case-transition.schema.json",
        "entry/skills/arckit-development-ledger/scripts/project-software-definition.mjs",
        "entry/skills/arckit-development-ledger/scripts/project-invariants.mjs",
        "runtime/arckit-runtime/schemas/agent-loop-result.schema.json",
        "runtime/arckit-runtime/schemas/runtime-result.schema.json",
        "runtime/arckit-runtime/test/project-ledger-governance.test.mjs",
        "runtime/arckit-runtime/test/state-condition-case.test.mjs",
        "verification:npm-run-check:84-tests-83-pass-1-conditional-skip",
        "verification:npm-run-smoke:valid-runtime-result",
        "verification:arcforge-applied-drift:using-arckit-and-ledger-same",
        "arckit/cases/active/CASE-20260810-001-implement-explicit-software-definition-project-state.md"
      ],
      "case_ref": "arckit/cases/active/CASE-20260810-001-implement-explicit-software-definition-project-state.md"
    },
    {
      "kind": "software_decision",
      "ref": "experience_and_interaction",
      "outcome": "settled",
      "evidence": [
        "arckit/spec/agentic-software-development/runtime-automation-workspace.md",
        "arckit/tech/arckit-runtime/desktop-execution-solution.md",
        "arckit/cases/active/CASE-20260810-003-upgrade-project-state-v5-content-evidence.md"
      ],
      "case_ref": "arckit/cases/active/CASE-20260810-003-upgrade-project-state-v5-content-evidence.md"
    },
    {
      "kind": "software_decision",
      "ref": "visual_language",
      "outcome": "settled",
      "evidence": [
        "arckit/visual/_library/brief.md",
        "arckit/visual/_library/design-tokens.yaml",
        "runtime/arckit-runtime/desktop/renderer/styles.css",
        "arckit/cases/active/CASE-20260810-003-upgrade-project-state-v5-content-evidence.md"
      ],
      "case_ref": "arckit/cases/active/CASE-20260810-003-upgrade-project-state-v5-content-evidence.md"
    },
    {
      "kind": "software_decision",
      "ref": "technical_foundation",
      "outcome": "settled",
      "evidence": [
        "entry/skills/arckit-development-ledger/schema/project-state-record.schema.json",
        "entry/skills/arckit-development-ledger/schema/development-case-record.schema.json",
        "entry/skills/arckit-development-ledger/schema/case-transition.schema.json",
        "entry/skills/arckit-development-ledger/scripts/project-software-definition.mjs",
        "entry/skills/arckit-development-ledger/scripts/project-invariants.mjs",
        "runtime/arckit-runtime/schemas/agent-loop-result.schema.json",
        "runtime/arckit-runtime/schemas/runtime-result.schema.json",
        "runtime/arckit-runtime/test/project-ledger-governance.test.mjs",
        "runtime/arckit-runtime/test/state-condition-case.test.mjs",
        "arckit/cases/closed/CASE-20260810-001-implement-explicit-software-definition-project-state.md",
        "arckit/cases/active/CASE-20260810-003-upgrade-project-state-v5-content-evidence.md"
      ],
      "case_ref": "arckit/cases/active/CASE-20260810-003-upgrade-project-state-v5-content-evidence.md"
    },
    {
      "kind": "software_decision",
      "ref": "observability_and_operation",
      "outcome": "settled",
      "evidence": [
        "arckit/tech/arckit-runtime/desktop-execution-solution.md",
        "runtime/arckit-runtime/src/observability/lifecycle-trace.mjs",
        "runtime/arckit-runtime/src/desktop/desktop-store.mjs",
        "runtime/arckit-runtime/src/runtime-record-ref.mjs",
        "arckit/cases/active/CASE-20260810-003-upgrade-project-state-v5-content-evidence.md"
      ],
      "case_ref": "arckit/cases/active/CASE-20260810-003-upgrade-project-state-v5-content-evidence.md"
    },
    {
      "kind": "software_decision",
      "ref": "technical_foundation",
      "outcome": "settled",
      "evidence": [
        "entry/skills/using-arckit/SKILL.md",
        "entry/skills/arckit-development-ledger/SKILL.md",
        "entry/skills/arckit-development-ledger/scripts/case-transition.mjs",
        "entry/skills/arckit-development-ledger/scripts/project-invariants.mjs",
        "runtime/arckit-runtime/src/agent-orchestrator.mjs",
        "runtime/arckit-runtime/src/gate-engine.mjs",
        "runtime/arckit-runtime/src/state-driven-runner.mjs",
        "runtime/arckit-runtime/schemas/agent-loop-result.schema.json",
        "runtime/arckit-runtime/test/case-transition.test.mjs",
        "runtime/arckit-runtime/test/state-condition-case.test.mjs",
        "runtime/arckit-runtime/test/coherent-agent-loop.test.mjs",
        "runtime/arckit-runtime/test/state-driven-runner.test.mjs",
        "arckit/tech/arckit-runtime/state-condition-ledger-solution.md",
        "npm --prefix runtime/arckit-runtime run check: 106 tests, 105 passed, 1 environment-gated skip",
        "arckit/cases/active/CASE-20260811-002-align-dynamic-gap-loop-and-invariant-semantics.md"
      ],
      "case_ref": "arckit/cases/active/CASE-20260811-002-align-dynamic-gap-loop-and-invariant-semantics.md"
    },
    {
      "kind": "software_decision",
      "ref": "data_and_state",
      "outcome": "settled",
      "evidence": [
        "entry/skills/using-arckit/SKILL.md",
        "entry/skills/arckit-development-ledger/SKILL.md",
        "entry/skills/arckit-development-ledger/scripts/case-transition.mjs",
        "entry/skills/arckit-development-ledger/scripts/project-invariants.mjs",
        "runtime/arckit-runtime/src/agent-orchestrator.mjs",
        "runtime/arckit-runtime/src/gate-engine.mjs",
        "runtime/arckit-runtime/src/state-driven-runner.mjs",
        "runtime/arckit-runtime/schemas/agent-loop-result.schema.json",